{
  "$schema": "http://json-schema.org/draft-07/schema#",
  "$id": "https://omc.dev/schemas/vibecodekit-hybrid/deliverables.json",
  "title": "vibecodekit-hybrid deliverables.json",
  "description": "Release-gate artifact emitted by the vibecodekit-hybrid VERIFY stage. Read by the HUD element, the Phase 4a GitHub Check Run gate, and `omc vibecodekit status|validate`.",
  "type": "object",
  "required": [
    "slug",
    "locale",
    "verify_gate",
    "verdict_counts",
    "release_decision",
    "artifact",
    "updated_at"
  ],
  "additionalProperties": false,
  "properties": {
    "slug": {
      "type": "string",
      "description": "Deliverable identifier in lowercase-kebab-case. Generated by `omc vibecodekit scaffold` via the same slugify rule used in the CLI.",
      "pattern": "^[a-z0-9]+(?:-[a-z0-9]+)*$",
      "minLength": 1,
      "maxLength": 80
    },
    "locale": {
      "type": "string",
      "description": "Resolved locale for this run. Must already be normalised by resolveVibecodekitLocale() — no POSIX-style values like 'vi_VN.UTF-8'.",
      "enum": ["en", "vi", "ja"]
    },
    "pattern": {
      "type": ["string", "null"],
      "description": "Vision pattern selected during VISION stage. Optional — null when scaffold ran without choosing a pattern. Must match a file under templates/vibecodekit-hybrid/vision-patterns/<pattern>.md.",
      "enum": [
        null,
        "landing",
        "saas",
        "dashboard",
        "blog",
        "portfolio",
        "enterprise-module",
        "mobile-app",
        "cli-tool",
        "data-pipeline",
        "custom"
      ]
    },
    "verify_gate": {
      "$ref": "#/$defs/gate",
      "description": "Aggregate VERIFY decision. Null while the run is still in BUILD."
    },
    "verdict_counts": {
      "type": "object",
      "required": ["pass", "fail", "painful", "missing"],
      "additionalProperties": false,
      "properties": {
        "pass": { "type": "integer", "minimum": 0 },
        "fail": { "type": "integer", "minimum": 0 },
        "painful": { "type": "integer", "minimum": 0 },
        "missing": { "type": "integer", "minimum": 0 }
      }
    },
    "release_decision": {
      "type": ["string", "null"],
      "description": "Stable enum used by Phase 4a Check Run mapping and HUD label. Null while VERIFY has not run.",
      "enum": [null, "SHIP", "SHIP_WITH_FOLLOWUPS", "DO_NOT_SHIP"]
    },
    "rri_t_gate": { "$ref": "#/$defs/gate" },
    "rri_ux_gate": { "$ref": "#/$defs/gate" },
    "rri_ui_gate": { "$ref": "#/$defs/gate" },
    "rri_sec_gate": { "$ref": "#/$defs/gate" },
    "artifact": {
      "type": "string",
      "description": "Repo-relative path to the verify report. Must live under .omc/.",
      "pattern": "^\\.omc/.+\\.md$",
      "minLength": 1
    },
    "updated_at": {
      "type": "string",
      "description": "ISO-8601 UTC timestamp (YYYY-MM-DDTHH:MM:SS[.sss]Z) written by the VERIFY stage when the gate was last refreshed.",
      "pattern": "^\\d{4}-\\d{2}-\\d{2}T\\d{2}:\\d{2}:\\d{2}(?:\\.\\d{1,3})?Z$"
    },
    "followups": {
      "type": "array",
      "description": "Follow-up TIPs surfaced by sub-skill verdicts. Required when release_decision = SHIP_WITH_FOLLOWUPS or DO_NOT_SHIP.",
      "items": { "$ref": "#/$defs/followup" }
    }
  },
  "allOf": [
    {
      "description": "When release_decision is SHIP_WITH_FOLLOWUPS or DO_NOT_SHIP, followups must be a non-empty array.",
      "if": {
        "properties": {
          "release_decision": { "enum": ["SHIP_WITH_FOLLOWUPS", "DO_NOT_SHIP"] }
        },
        "required": ["release_decision"]
      },
      "then": {
        "required": ["followups"],
        "properties": {
          "followups": { "type": "array", "minItems": 1 }
        }
      }
    }
  ],
  "$defs": {
    "gate": {
      "description": "Stoplight gate. Canonical glyph only (🟢 / 🟡 / 🔴) or null. Producers MUST emit the bare glyph because both the HUD reader and the CI gate check exact-match against this set.",
      "type": ["string", "null"],
      "pattern": "^(🟢|🟡|🔴)$"
    },
    "followup": {
      "type": "object",
      "required": ["id", "from", "verdict", "summary", "owner"],
      "additionalProperties": false,
      "properties": {
        "id": {
          "type": "string",
          "pattern": "^FU-[0-9]{3,}$"
        },
        "from": {
          "type": "string",
          "enum": ["verify", "rri-t", "rri-ux", "rri-ui", "rri-sec", "scan", "vision", "build"]
        },
        "verdict": {
          "type": "string",
          "enum": ["PASS", "FAIL", "PAINFUL", "MISSING"]
        },
        "summary": {
          "type": "string",
          "minLength": 1,
          "maxLength": 500
        },
        "owner": {
          "type": "string",
          "enum": ["executor", "designer", "verifier", "interviewer", "scanner", "user"]
        },
        "follow_up_tip": {
          "type": "string",
          "pattern": "^\\.omc/.+\\.md$"
        }
      }
    }
  }
}
